{
  "schema_version": "1.0.0",
  "slug": "onboarding-cro",
  "name": "Onboarding Cro",
  "pack": "marketing",
  "pack_label": "Marketing",
  "version": "1.1.0",
  "status": "stable",
  "artifact_type": "skill",
  "summary": "When the user wants to optimize post-signup onboarding, user activation, first-run experience, or time-to-value. Also use when the user mentions \"onboarding\u2026",
  "description": "When the user wants to optimize post-signup onboarding, user activation, first-run experience, or time-to-value. Also use when the user mentions \"onboarding flow,\" \"activation rate,\" \"user activation,\" \"first-run experience,\" \"empty states,\" \"onboarding checklist,\" \"aha moment,\" \"new user experience,\" \"users aren't activating,\" \"nobody completes setup,\" \"low activation rate,\" \"users sign up but don't use the product,\" \"time to value,\" or \"first session experience.\" Use this whenever users are signing up but not sticking around. For signup/registration optimization, see signup-flow-cro. For ongoing email sequences, see email-sequence.",
  "skill_id": "SK-0090",
  "skill_path": "skills/marketing/onboarding-cro",
  "skill_md": "SKILL.md",
  "lead_sheet_md": "skill.plugin.md",
  "author": "marvelousempire",
  "author_uri": "https://github.com/marvelousempire",
  "license": "MIT",
  "repository": null,
  "homepage": null,
  "requires": [],
  "tools": [
    "cursor",
    "claude"
  ],
  "triggers": [
    "write-onboarding",
    "check-cro",
    "file-onboarding"
  ],
  "keywords": [
    "write-onboarding",
    "check-cro",
    "file-onboarding"
  ],
  "overlap": [],
  "relations": [],
  "governed_by": [
    "global"
  ],
  "philosophy": null,
  "philosophy_tagline": null,
  "invoke": "Use **onboarding-cro**.",
  "icon": null,
  "featured": false,
  "generated_at": "2026-05-21T08:11:23Z",
  "hash": "a44084a",
  "goal": "Deliver onboarding cro output correctly and completely."
}
