{
  "schema_version": "1.0.0",
  "slug": "create-rule",
  "name": "Create Rule",
  "pack": "engineering",
  "pack_label": "Engineering",
  "version": "1.0.0",
  "status": "stable",
  "artifact_type": "skill",
  "summary": "Create Cursor rules for persistent AI guidance. Use when you want to create a rule, add coding standards, set up project conventions, configure file-specific\u2026",
  "description": "Create Cursor rules for persistent AI guidance. Use when you want to create a rule, add coding standards, set up project conventions, configure file-specific patterns, create RULE.md files, or asks about .cursor/rules/ or AGENTS.md.",
  "skill_id": "SK-0020",
  "skill_path": "skills/engineering/create-rule",
  "skill_md": "SKILL.md",
  "lead_sheet_md": "skill.plugin.md",
  "author": "marvelousempire",
  "author_uri": "https://github.com/marvelousempire",
  "license": "MIT",
  "repository": null,
  "homepage": null,
  "requires": [],
  "tools": [
    "cursor",
    "claude"
  ],
  "triggers": [
    "create-rule",
    "define-policy",
    "write-rule"
  ],
  "keywords": [
    "create-rule",
    "define-policy",
    "write-rule"
  ],
  "overlap": [],
  "relations": [],
  "governed_by": [
    "global"
  ],
  "philosophy": null,
  "philosophy_tagline": null,
  "invoke": "Use **create-rule**.",
  "icon": null,
  "featured": false,
  "generated_at": "2026-05-19T19:05:57Z",
  "hash": "afcd8a6",
  "goal": "Deliver create rule output correctly and completely."
}
