{
  "schema_version": "1.0.0",
  "slug": "verify-ship",
  "name": "Verify Ship",
  "pack": "project/red-e-play",
  "pack_label": "Red-E Play",
  "version": "1.0.0",
  "status": "stable",
  "artifact_type": "skill",
  "summary": "Audit whether work has actually shipped \u2014 committed, pushed, merged, deployed. Use when the user asks variants of \"did it ship\", \"is it on origin\", \"are we\u2026",
  "description": "Audit whether work has actually shipped \u2014 committed, pushed, merged, deployed. Use when the user asks variants of \"did it ship\", \"is it on origin\", \"are we backed up\", \"did we merge\", \"is this in main yet\", \"is the build live\", \"is the redesign deployed\", \"show me the state\". Returns a concrete table of git state + PR state + version on each surface so the user can confirm at a glance instead of getting piecemeal answers.",
  "skill_id": "SK-0124",
  "skill_path": "skills/project/red-e-play/verify-ship",
  "skill_md": "SKILL.md",
  "lead_sheet_md": "skill.plugin.md",
  "author": "marvelousempire",
  "author_uri": "https://github.com/marvelousempire",
  "license": "MIT",
  "repository": null,
  "homepage": null,
  "requires": [],
  "tools": [
    "cursor",
    "claude"
  ],
  "triggers": [
    "verify-ship",
    "check-deploy",
    "confirm-release"
  ],
  "keywords": [
    "verify-ship",
    "check-deploy",
    "confirm-release"
  ],
  "overlap": [],
  "relations": [],
  "governed_by": [
    "global"
  ],
  "philosophy": null,
  "philosophy_tagline": null,
  "invoke": "Use **verify-ship**.",
  "icon": null,
  "featured": false,
  "generated_at": "2026-05-19T19:05:57Z",
  "hash": "f850b2d",
  "goal": "Deliver verify ship output correctly and completely."
}
