{
  "schema_version": "1.0.0",
  "slug": "marketplace-with-trust-reserve",
  "name": "Marketplace With Trust Reserve",
  "pack": "engineering/architecture",
  "pack_label": "Engineering \u00b7 Architecture",
  "version": "1.0.0",
  "status": "stable",
  "artifact_type": "skill",
  "summary": "Design a two-sided marketplace with anti-fraud designed in from day one. Players spend \u2192 escrow \u2192 split: 15% platform / 3% processor / 2% trust-safety reserve\u2026",
  "description": "Design a two-sided marketplace with anti-fraud designed in from day one. Players spend \u2192 escrow \u2192 split: 15% platform / 3% processor / 2% trust-safety reserve / 80% supplier payout. The 20% retained is not pure margin \u2014 it funds the audit machinery that makes the marketplace credible.",
  "skill_id": "SK-0004",
  "skill_path": "skills/engineering/architecture/marketplace-with-trust-reserve",
  "skill_md": "SKILL.md",
  "lead_sheet_md": "skill.plugin.md",
  "author": "marvelousempire",
  "author_uri": "https://github.com/marvelousempire",
  "license": "MIT",
  "repository": null,
  "homepage": null,
  "requires": [],
  "tools": [
    "cursor",
    "claude"
  ],
  "triggers": [
    "setup-marketplace",
    "configure-trust",
    "reserve-funds"
  ],
  "keywords": [
    "setup-marketplace",
    "configure-trust",
    "reserve-funds"
  ],
  "overlap": [],
  "relations": [],
  "governed_by": [
    "global"
  ],
  "philosophy": null,
  "philosophy_tagline": null,
  "invoke": "Use **marketplace-with-trust-reserve**.",
  "icon": null,
  "featured": false,
  "generated_at": "2026-05-19T19:05:57Z",
  "hash": "3ab8d29",
  "goal": "Deliver marketplace with trust reserve output correctly and completely."
}
