{
  "schema_version": "1.0.0",
  "slug": "post-ship-elevation-pass",
  "name": "Post Ship Elevation Pass",
  "pack": "engineering",
  "pack_label": "Engineering",
  "version": "1.0.0",
  "status": "stable",
  "artifact_type": "skill",
  "summary": "After every substantive ship, immediately run two passes before closing the session: (1) GAP AUDIT \u2014 list everything incomplete, deferred, fragile, or\u2026",
  "description": "After every substantive ship, immediately run two passes before closing the session: (1) GAP AUDIT \u2014 list everything incomplete, deferred, fragile, or untested with the file and function name; (2) ELEVATION PASS \u2014 read the user's intent, not just the literal request, and propose the most ambitious version of the feature. Present as two labeled lists. Wait for sign-off before implementing elevations. Triggers on \"gap audit\", \"elevation pass\", \"what's left after this\", \"what would the most ambitious version be\", \"are there gaps\", \"what did we miss\", \"elevate this\", \"what else should we do after shipping\".",
  "skill_id": "SK-0033",
  "skill_path": "skills/engineering/post-ship-elevation-pass",
  "skill_md": "SKILL.md",
  "lead_sheet_md": "skill.plugin.md",
  "author": "marvelousempire",
  "author_uri": "https://github.com/marvelousempire",
  "license": "MIT",
  "repository": null,
  "homepage": null,
  "requires": [
    "confirm-ship-clearly"
  ],
  "tools": [
    "cursor",
    "claude"
  ],
  "triggers": [
    "audit-gaps",
    "propose-elevations",
    "wait-approval"
  ],
  "keywords": [
    "audit-gaps",
    "propose-elevations",
    "wait-approval"
  ],
  "overlap": [],
  "relations": [
    "gap-audit-and-elevation",
    "create-skill"
  ],
  "governed_by": [
    "global"
  ],
  "philosophy": null,
  "philosophy_tagline": null,
  "invoke": "Use **post-ship-elevation-pass**.",
  "icon": null,
  "featured": false,
  "generated_at": "2026-05-19T19:05:57Z",
  "hash": "1451c13",
  "goal": "Every shipped feature is immediately audited for gaps and extended with its most ambitious version."
}
