{
  "schema_version": "1.0.0",
  "slug": "ai-seo",
  "name": "Ai Seo",
  "pack": "marketing",
  "pack_label": "Marketing",
  "version": "1.2.0",
  "status": "stable",
  "artifact_type": "skill",
  "summary": "When the user wants to optimize content for AI search engines, get cited by LLMs, or appear in AI-generated answers. Also use when the user mentions 'AI SEO,'\u2026",
  "description": "When the user wants to optimize content for AI search engines, get cited by LLMs, or appear in AI-generated answers. Also use when the user mentions 'AI SEO,' 'AEO,' 'GEO,' 'LLMO,' 'answer engine optimization,' 'generative engine optimization,' 'LLM optimization,' 'AI Overviews,' 'optimize for ChatGPT,' 'optimize for Perplexity,' 'AI citations,' 'AI visibility,' 'zero-click search,' 'how do I show up in AI answers,' 'LLM mentions,' or 'optimize for Claude/Gemini.' Use this whenever someone wants their content to be cited or surfaced by AI assistants and AI search engines. For traditional technical and on-page SEO audits, see seo-audit. For structured data implementation, see schema-markup.",
  "skill_id": "SK-0066",
  "skill_path": "skills/marketing/ai-seo",
  "skill_md": "SKILL.md",
  "lead_sheet_md": "skill.plugin.md",
  "author": "marvelousempire",
  "author_uri": "https://github.com/marvelousempire",
  "license": "MIT",
  "repository": null,
  "homepage": null,
  "requires": [],
  "tools": [
    "cursor",
    "claude"
  ],
  "triggers": [
    "write-seo"
  ],
  "keywords": [
    "write-seo"
  ],
  "overlap": [],
  "relations": [],
  "governed_by": [
    "global"
  ],
  "philosophy": null,
  "philosophy_tagline": null,
  "invoke": "Use **ai-seo**.",
  "icon": null,
  "featured": false,
  "generated_at": "2026-05-19T19:05:57Z",
  "hash": "bffcb72",
  "goal": "Deliver ai seo output correctly and completely."
}
