{
  "schema_version": "1.0.0",
  "slug": "analytics-tracking",
  "name": "Analytics Tracking",
  "pack": "marketing",
  "pack_label": "Marketing",
  "version": "1.1.0",
  "status": "stable",
  "artifact_type": "skill",
  "summary": "When the user wants to set up, improve, or audit analytics tracking and measurement. Also use when the user mentions \"set up tracking,\" \"GA4,\" \"Google\u2026",
  "description": "When the user wants to set up, improve, or audit analytics tracking and measurement. Also use when the user mentions \"set up tracking,\" \"GA4,\" \"Google Analytics,\" \"conversion tracking,\" \"event tracking,\" \"UTM parameters,\" \"tag manager,\" \"GTM,\" \"analytics implementation,\" \"tracking plan,\" \"how do I measure this,\" \"track conversions,\" \"attribution,\" \"Mixpanel,\" \"Segment,\" \"are my events firing,\" or \"analytics isn't working.\" Use this whenever someone asks how to know if something is working or wants to measure marketing results. For A/B test measurement, see ab-test-setup.",
  "skill_id": "SK-0067",
  "skill_path": "skills/marketing/analytics-tracking",
  "skill_md": "SKILL.md",
  "lead_sheet_md": "skill.plugin.md",
  "author": "marvelousempire",
  "author_uri": "https://github.com/marvelousempire",
  "license": "MIT",
  "repository": null,
  "homepage": null,
  "requires": [],
  "tools": [
    "cursor",
    "claude"
  ],
  "triggers": [
    "write-analytics",
    "check-tracking",
    "file-analytics"
  ],
  "keywords": [
    "write-analytics",
    "check-tracking",
    "file-analytics"
  ],
  "overlap": [],
  "relations": [],
  "governed_by": [
    "global"
  ],
  "philosophy": null,
  "philosophy_tagline": null,
  "invoke": "Use **analytics-tracking**.",
  "icon": null,
  "featured": false,
  "generated_at": "2026-05-21T08:11:23Z",
  "hash": "c376d5d",
  "goal": "Deliver analytics tracking output correctly and completely."
}
