{
  "schema_version": "1.0.0",
  "slug": "site-architecture",
  "name": "Site Architecture",
  "pack": "marketing",
  "pack_label": "Marketing",
  "version": "1.1.0",
  "status": "stable",
  "artifact_type": "skill",
  "summary": "When the user wants to plan, map, or restructure their website's page hierarchy, navigation, URL structure, or internal linking. Also use when the user\u2026",
  "description": "When the user wants to plan, map, or restructure their website's page hierarchy, navigation, URL structure, or internal linking. Also use when the user mentions \"sitemap,\" \"site map,\" \"visual sitemap,\" \"site structure,\" \"page hierarchy,\" \"information architecture,\" \"IA,\" \"navigation design,\" \"URL structure,\" \"breadcrumbs,\" \"internal linking strategy,\" \"website planning,\" \"what pages do I need,\" \"how should I organize my site,\" or \"site navigation.\" Use this whenever someone is planning what pages a website should have and how they connect. NOT for XML sitemaps (that's technical SEO \u2014 see seo-audit). For SEO audits, see seo-audit. For structured data, see schema-markup.",
  "skill_id": "SK-0104",
  "skill_path": "skills/marketing/site-architecture",
  "skill_md": "SKILL.md",
  "lead_sheet_md": "skill.plugin.md",
  "author": "marvelousempire",
  "author_uri": "https://github.com/marvelousempire",
  "license": "MIT",
  "repository": null,
  "homepage": null,
  "requires": [],
  "tools": [
    "cursor",
    "claude"
  ],
  "triggers": [
    "write-site",
    "check-architecture",
    "file-site"
  ],
  "keywords": [
    "write-site",
    "check-architecture",
    "file-site"
  ],
  "overlap": [],
  "relations": [],
  "governed_by": [
    "global"
  ],
  "philosophy": null,
  "philosophy_tagline": null,
  "invoke": "Use **site-architecture**.",
  "icon": null,
  "featured": false,
  "generated_at": "2026-05-19T19:05:57Z",
  "hash": "62442f1",
  "goal": "Deliver site architecture output correctly and completely."
}
