{
  "schema_version": "1.0.0",
  "slug": "update-cli-config",
  "name": "Update Cli Config",
  "pack": "engineering",
  "pack_label": "Engineering",
  "version": "1.0.0",
  "status": "stable",
  "artifact_type": "skill",
  "summary": "View and modify Cursor CLI configuration settings in ~/.cursor/cli-config.json. Use when the user wants to change CLI settings, configure permissions, switch\u2026",
  "description": "View and modify Cursor CLI configuration settings in ~/.cursor/cli-config.json. Use when the user wants to change CLI settings, configure permissions, switch approval mode, enable vim mode, toggle display options, configure sandbox, or manage any CLI preferences.",
  "skill_id": "SK-0048",
  "skill_path": "skills/engineering/update-cli-config",
  "skill_md": "SKILL.md",
  "lead_sheet_md": "skill.plugin.md",
  "author": "marvelousempire",
  "author_uri": "https://github.com/marvelousempire",
  "license": "MIT",
  "repository": null,
  "homepage": null,
  "requires": [],
  "tools": [
    "cursor",
    "claude"
  ],
  "triggers": [
    "update-config",
    "configure-cli",
    "set-option"
  ],
  "keywords": [
    "update-config",
    "configure-cli",
    "set-option"
  ],
  "overlap": [],
  "relations": [],
  "governed_by": [
    "global"
  ],
  "philosophy": null,
  "philosophy_tagline": null,
  "invoke": "Use **update-cli-config**.",
  "icon": null,
  "featured": false,
  "generated_at": "2026-05-21T08:11:23Z",
  "hash": "b3888e1",
  "goal": "Deliver update cli config output correctly and completely."
}
