{
  "schema_version": "1.0.0",
  "slug": "your-skill-slug",
  "name": "Your Skill Name",
  "pack": "methodology",
  "pack_label": "Methodology",
  "version": "1.0.0",
  "status": "stable",
  "artifact_type": "skill",
  "summary": "One line for the plugin directory card (≤160 chars).",
  "description": "Full trigger-rich description (matches SKILL.md frontmatter).",
  "skill_id": null,
  "skill_path": "skills/methodology/your-skill-slug",
  "skill_md": "SKILL.md",
  "lead_sheet_md": "skill.plugin.md",
  "author": "marvelousempire",
  "author_uri": "https://github.com/marvelousempire",
  "license": "MIT",
  "repository": null,
  "homepage": null,
  "requires": [],
  "tools": ["cursor", "claude"],
  "triggers": [],
  "keywords": [],
  "overlap": [],
  "relations": [],
  "governed_by": [],
  "philosophy": null,
  "philosophy_tagline": null,
  "invoke": "Use your-skill-slug.",
  "icon": null,
  "featured": false,
  "generated_at": "2026-01-01T00:00:00Z",
  "hash": null,
  "goal": null
}
