{
  "schema_version": "1.0.0",
  "slug": "bash-installer-oneliners",
  "name": "Bash Installer Oneliners",
  "pack": "project/yousirjuan",
  "pack_label": "You-Sir Juan",
  "version": "1.0.0",
  "status": "stable",
  "artifact_type": "skill",
  "summary": "Production-quality bash installer structure for You-Sir Juan OS one-liners. Covers: detect \u2192 deps \u2192 clone/update \u2192 configure \u2192 services \u2192 model \u2192 LaunchAgent\u2026",
  "description": "Production-quality bash installer structure for You-Sir Juan OS one-liners. Covers: detect \u2192 deps \u2192 clone/update \u2192 configure \u2192 services \u2192 model \u2192 LaunchAgent \u2192 open. Paired with GitHub Actions release pipeline and VPS nginx serving.",
  "skill_id": "SK-0126",
  "skill_path": "skills/project/yousirjuan/bash-installer-oneliners",
  "skill_md": "SKILL.md",
  "lead_sheet_md": "skill.plugin.md",
  "author": "marvelousempire",
  "author_uri": "https://github.com/marvelousempire",
  "license": "MIT",
  "repository": null,
  "homepage": null,
  "requires": [],
  "tools": [
    "cursor",
    "claude"
  ],
  "triggers": [
    "run-bash",
    "check-installer",
    "build-oneliners"
  ],
  "keywords": [
    "run-bash",
    "check-installer",
    "build-oneliners"
  ],
  "overlap": [],
  "relations": [],
  "governed_by": [
    "global"
  ],
  "philosophy": null,
  "philosophy_tagline": null,
  "invoke": "Use **bash-installer-oneliners**.",
  "icon": null,
  "featured": false,
  "generated_at": "2026-05-19T19:05:57Z",
  "hash": "d09cc4f",
  "goal": "Deliver bash installer oneliners output correctly and completely."
}
