{
  "schema_version": "1.0.0",
  "slug": "ltx-2",
  "name": "Ltx 2",
  "pack": "external",
  "pack_label": "External bridge",
  "version": "1.0.0",
  "status": "bridge",
  "artifact_type": "bridge",
  "summary": "LTX-2 \\u2014 Official Python inference and LoRA trainer package for the LTX-2 audio-video generative model (Lightricks). Use when the user mentions or needs:\u2026",
  "description": "LTX-2 \\u2014 Official Python inference and LoRA trainer package for the LTX-2 audio-video generative model (Lightricks). Use when the user mentions or needs: LTX-2; Lightricks LTX; LTX-2 inference; LTX-2 LoRA training; audio-video generative model Python.",
  "skill_id": null,
  "skill_path": "skills/external/ltx-2",
  "skill_md": "SKILL.md",
  "lead_sheet_md": "skill.plugin.md",
  "author": "marvelousempire",
  "author_uri": "https://github.com/marvelousempire",
  "license": "MIT",
  "repository": null,
  "homepage": null,
  "requires": [],
  "tools": [
    "cursor",
    "claude"
  ],
  "triggers": [
    "integrate-ltx"
  ],
  "keywords": [
    "integrate-ltx"
  ],
  "overlap": [],
  "relations": [],
  "governed_by": [
    "global"
  ],
  "philosophy": null,
  "philosophy_tagline": null,
  "invoke": "Use **ltx-2**.",
  "icon": null,
  "featured": false,
  "generated_at": "2026-05-21T08:11:23Z",
  "hash": "d45b11a",
  "goal": "Deliver ltx 2 output correctly and completely."
}
