{
  "schema_version": "1.0.0",
  "slug": "compliance-matrix",
  "name": "Compliance Matrix",
  "pack": "methodology",
  "pack_label": "Methodology",
  "version": "1.0.0",
  "status": "stable",
  "artifact_type": "skill",
  "summary": "Per-stack / per-X compliance snapshots in markdown tables. Update on every change to ensure no stack drifts off the contract (label schema, frontmatter,\u2026",
  "description": "Per-stack / per-X compliance snapshots in markdown tables. Update on every change to ensure no stack drifts off the contract (label schema, frontmatter, doctor presence, etc.). Triggers on \"compliance check\", \"per-stack matrix\", \"which stacks have X\". See `docs/standards/` and `docs/improvement/recurring-wins.md` for context. Pairs with the canonical reference: `docs/templates/integration-checklist.md.template` and `skills/infra/dockyard/references/integration-checklist.md`.",
  "skill_id": "SK-0108",
  "skill_path": "skills/methodology/compliance-matrix",
  "skill_md": "SKILL.md",
  "lead_sheet_md": "skill.plugin.md",
  "author": "marvelousempire",
  "author_uri": "https://github.com/marvelousempire",
  "license": "MIT",
  "repository": null,
  "homepage": null,
  "requires": [],
  "tools": [
    "cursor",
    "claude"
  ],
  "triggers": [
    "build-matrix",
    "track-compliance",
    "verify-rule"
  ],
  "keywords": [
    "build-matrix",
    "track-compliance",
    "verify-rule"
  ],
  "overlap": [],
  "relations": [],
  "governed_by": [
    "global"
  ],
  "philosophy": null,
  "philosophy_tagline": null,
  "invoke": "Use **compliance-matrix**.",
  "icon": null,
  "featured": false,
  "generated_at": "2026-05-19T19:05:57Z",
  "hash": "e4f9500",
  "goal": "Deliver compliance matrix output correctly and completely."
}
