{
  "schema_version": "1.0.0",
  "slug": "statusline",
  "name": "Statusline",
  "pack": "engineering",
  "pack_label": "Engineering",
  "version": "1.0.0",
  "status": "stable",
  "artifact_type": "skill",
  "summary": "Configure a custom status line in the CLI. Use when the user mentions status line, statusline, statusLine, CLI status bar, prompt footer customization, or\u2026",
  "description": "Configure a custom status line in the CLI. Use when the user mentions status line, statusline, statusLine, CLI status bar, prompt footer customization, or wants to add session context above the prompt.",
  "skill_id": "SK-0046",
  "skill_path": "skills/engineering/statusline",
  "skill_md": "SKILL.md",
  "lead_sheet_md": "skill.plugin.md",
  "author": "marvelousempire",
  "author_uri": "https://github.com/marvelousempire",
  "license": "MIT",
  "repository": null,
  "homepage": null,
  "requires": [],
  "tools": [
    "cursor",
    "claude"
  ],
  "triggers": [
    "show-status",
    "configure-bar",
    "display-info"
  ],
  "keywords": [
    "show-status",
    "configure-bar",
    "display-info"
  ],
  "overlap": [],
  "relations": [],
  "governed_by": [
    "global"
  ],
  "philosophy": null,
  "philosophy_tagline": null,
  "invoke": "Use **statusline**.",
  "icon": null,
  "featured": false,
  "generated_at": "2026-05-21T08:11:23Z",
  "hash": "8b21fbc",
  "goal": "Deliver statusline output correctly and completely."
}
